id_site,nom,region,ville_commune,type_activite,sous_types_tags,latitude,longitude,adresse_ou_description_localisation,difficulte,duree_typique_visite,prix_approximatif_ar,prix_approximatif_eur,saison_recommandee,note_moyenne,nombre_avis,source_note,lien_page,description_courte,acces_transport,contraintes,cluster
356,Tsimanampetsotsa (zone observation tortues),Atsimo-Andrefana,Betioky Sud,Observation animalière,Tortues radiées Tsimanampetsotsa,-24.1,43.75,Zone tortues du parc,Moyen,8.0,20000,4.0,Avril à décembre,4.6,190,TripAdvisor,https://www.tripadvisor.com/Attraction_Review-g298288-d614308-Reviews-Tsimanampetsotse_Tortoises-Madagascar.html,Observation tortues radiées endémiques,4x4 depuis Toliara,Chaleur extrême,1
357,Beza-Mahafaly (zone Parcelle 5),Atsimo-Andrefana,Betioky Sud,Observation animalière,"Parcelle 5, Faune nocturne",-23.65,44.6333,Parcelle 5 de Beza-Mahafaly,Moyen,4.0,15000,3.0,Avril à décembre,4.5,90,Audley Travel,https://www.audleytravel.com/madagascar/places-to-go/beza-mahafaly,Zone pour observation nocturne de faune,Voiture + guide,Aucune,1
358,Plage Lokaro (zone excursion complète),Analanjirofo,Foulpointe,Plages et littoral,Excursion journée entière Lokaro,-17.1,49.9833,Lokaro complet,Facile,8.0,30000,6.0,Mai à octobre,4.6,160,Lonely Planet,https://www.lonelyplanet.com/madagascar/attractions/lokaro-excursion,Excursion complète avec plage et mangrove,Bateau depuis Foulpointe,Aucune,0
359,Lac Anony (zone lagune),Anosy,Amboasary Sud,Nature et parcs nationaux,"Lagune Anony, Oiseaux",-25.0833,46.95,Zone lagune lac Anony,Facile,1.5,0,0.0,Mai à novembre,4.4,110,SafariBookings,https://www.safaribookings.com/blog/lac-anony-lagoon,Lagune reliant lac et mer avec oiseaux,Voiture depuis Taolagnaro,Soleil intense,6
360,Andringitra (zone faune),Haute Matsiatra,Ambalavao,Observation animalière,"Lémuriens, Oiseaux Andringitra",-22.2,46.8833,Zone faune Andringitra,Moyen,8.0,30000,6.0,Avril à novembre,4.7,220,TripAdvisor,https://www.tripadvisor.com/Attraction_Review-g298278-d614309-Reviews-Andringitra_Fauna-Madagascar.html,Observation faune dans le massif granitique,Voiture + randonnée,Randonnée physique,3
361,Anja (zone rochers supérieurs),Haute Matsiatra,Ambalavao,Géologie et paysages,Rochers supérieurs Anja,-21.8333,46.9333,Zone haute rochers Anja,Moyen,2.5,10000,2.0,Mai à octobre,4.7,600,Audley Travel,https://www.audleytravel.com/madagascar/places-to-go/anja-upper-rocks,Rochers supérieurs avec vue et lémuriens,Voiture depuis Ambalavao,Aucune,5
362,Train FCE (zone cascades),Haute Matsiatra,Fianarantsoa,Nature et parcs nationaux,Cascades vues depuis train,-21.4536,47.0858,Zone cascades FCE,Facile,1.5,0,0.0,Mai à octobre,4.5,320,Lonely Planet,https://www.lonelyplanet.com/madagascar/attractions/fce-cascades,Cascades visibles depuis le trajet ferroviaire,Train,Retards possibles,2
363,Sources thermales Antsirabe (zone naturelle),Vakinankaratra,Antsirabe,Thermalisme et bien-être,Sources naturelles brutes,-19.8667,47.0333,Zone sources brutes Antsirabe,Facile,4.0,5000,1.0,Toute l'année,4.3,240,TripAdvisor,https://www.tripadvisor.com/Attraction_Review-g298279-d614310-Reviews-Natural_Thermal_Springs-Antsirabe_Antananarivo_Province.html,Sources thermales naturelles sans aménagement,Taxi ou marche,Aucune,2
364,Lac Andraikiba (zone forêt),Vakinankaratra,Antsirabe,Nature et parcs nationaux,Forêt autour du lac,-19.9167,47.0667,Zone forêt Andraikiba,Facile,2.5,0,0.0,Avril à novembre,4.4,170,Audley Travel,https://www.audleytravel.com/madagascar/places-to-go/andraikiba-forest,Forêt environnante du lac de cratère,Voiture ou taxi,Aucune,2
365,Betafo (zone village bas),Vakinankaratra,Betafo,Culture et histoire,Village bas Betafo,-19.8333,46.85,Zone basse Betafo,Facile,2.5,0,0.0,Toute l'année,4.5,230,Lonely Planet,https://www.lonelyplanet.com/madagascar/attractions/betafo-lower-village,Partie basse du village avec rizières,Voiture ou taxi,Aucune,2
366,Lac Itasy (zone observation volcan),Itasy,Arivonimamo,Géologie et paysages,Volcans vus depuis lac,-19.0667,46.7833,Zone volcan Itasy,Facile,4.0,0,0.0,Avril à novembre,4.3,120,SafariBookings,https://www.safaribookings.com/blog/lac-itasy-volcano-view,Vue sur volcans éteints depuis le lac,Voiture ou pirogue,Aucune,2
367,Chute de la Lily (zone bassin),Itasy,Arivonimamo,Nature et parcs nationaux,Bassin baignade Lily,-19.0333,46.8,Zone bassin chute Lily,Facile,1.5,5000,1.0,Avril à novembre,4.4,90,Audley Travel,https://www.audleytravel.com/madagascar/places-to-go/lily-basin,Bassin naturel pour baignade sous la chute,Voiture + courte marche,Sentier glissant,2
368,Massif Tsaratanana (zone campement),Betsiboka,Bealanana,Aventure et randonnée,Zone campement Tsaratanana,-16.7833,47.65,Zone campement massif,Difficile,,40000,8.0,Avril à novembre,4.8,40,Lonely Planet,https://www.lonelyplanet.com/madagascar/attractions/tsaratanana-camps,Zone campement pour expéditions multi-jours,Expédition guidée,Altitude élevée,4
369,Pic Saint-Louis (zone faune),Anosy,Taolagnaro,Observation animalière,"Oiseaux, Caméléons Pic Saint-Louis",-25.05,46.9833,Zone faune Pic Saint-Louis,Moyen,2.0,5000,1.0,Mai à novembre,4.5,140,TripAdvisor,https://www.tripadvisor.com/Attraction_Review-g298283-d614311-Reviews-Pic_Saint_Louis_Fauna-Madagascar.html,Observation oiseaux et caméléons sur le sentier,Voiture + randonnée,Soleil intense,6
370,Plage Libanona (zone pêche),Anosy,Taolagnaro,Plages et littoral,Zone pêche plage Libanona,-25.0318,46.9993,Zone pêche Libanona,Facile,2.5,0,0.0,Mai à novembre,4.4,200,Audley Travel,https://www.audleytravel.com/madagascar/places-to-go/libanona-fishing,Zone pêche locale sur la plage urbaine,Marche ou taxi local,Aucune,6
371,Ambalabongo Canyon,Boeny,Marovoay,Géologie et paysages,"Canyon rouge, Érosion fluviale",-16.1,46.6,"Près de Marovoay, ouest",Moyen,1.5,0,0.0,Mai à octobre,4.3,80,Atlas Obscura,https://www.atlasobscura.com/places/ambalabongo-canyon,Canyon avec falaises rouges sculptées par l'érosion,Voiture ou 4x4,Soleil intense,2
372,Aven Cave,Atsimo-Andrefana,Toliara,Aventure et randonnée,"Cave sous-marine, Fossiles",-23.35,43.65,"Près de Toliara, sud-ouest",Difficile,8.0,20000,4.0,Avril à décembre,4.5,120,Atlas Obscura,https://www.atlasobscura.com/places/aven-cave,Cave sous-marine avec plus grand cimetière fossiles,Bateau + équipement spéléo,Accès subaquatique,1
373,Mad Zebu (restaurant),Haute Matsiatra,Fianarantsoa,Gastronomie et vignobles,"Cuisine malgache, Dégustation locale",-21.45,47.08,Centre Fianarantsoa,Facile,1.5,25000,5.0,Toute l'année,4.7,400,Beyond the Bucketlist,https://beyondthebucketlist.co/mad-zebu-restaurant-madagascar,Restaurant renommé pour cuisine malgache exceptionnelle,Taxi ou marche,Aucune,3
374,Manja to Morondava Road,Menabe,Manja,Aventure et randonnée,"Route off-road, Paysages ruraux",-20.8,44.2,Route entre Manja et Morondava,Difficile,8.0,0,0.0,Mai à octobre,4.4,150,Helen in Wonderlust,https://www.heleninwonderlust.co.uk/manja-morondava-road-madagascar,Route aventureuse traversant paysages sauvages,4x4 ou taxi-brousse,Route poussiéreuse,1
375,Antananarivo Cultural Immersion,Analamanga,Antananarivo,Culture et histoire,"Marchés, Cuisine urbaine",-18.91,47.53,Quartiers centraux Tana,Facile,4.0,0,0.0,Mai à octobre,4.5,600,Beyond the Bucketlist,https://beyondthebucketlist.co/antananarivo-culture-madagascar,Immersion dans culture et histoire de la capitale,Taxi ou marche,Foule urbaine,2
376,Ampefy (volcanic area),Itasy,Ampefy,Géologie et paysages,"Chutes, Geysers, Volcans éteints",-19.0,46.75,Région Ampefy,Moyen,8.0,10000,2.0,Avril à novembre,4.4,200,Responsible Travel,https://www.responsibletravel.com/holidays/madagascar/travel-guide/ampefy,Zone volcanique avec chutes et geysers,Voiture depuis Antananarivo,Sentiers escarpés,3
377,Lake Anosy,Analamanga,Antananarivo,Volcanisme et lacs,"Lac coeur, Monument aux morts",-18.93,47.53,Centre Antananarivo,Facile,0.5,0,0.0,Mai à octobre,4.2,350,Cedarberg Travel,https://www.cedarberg-travel.com/lake-anosy-antananarivo,Lac artificiel en forme de coeur avec monument central,Marche ou taxi,Aucune,2
378,Tsimbazaza Zoo,Analamanga,Antananarivo,Observation animalière,"Jardin botanique, Zoo historique",-18.93,47.53,Près du lac Anosy,Facile,2.5,8000,1.6,Mai à octobre,4.0,250,Rhino Africa,https://www.rhinoafrica.com/en/destinations/madagascar/tsimbazaza-zoo,Zoo et jardin botanique avec faune et flore malgache,Taxi,Aucune,2
379,Ambohidrapeto Hill,Analamanga,Antananarivo,Culture et histoire,"Colline sacrée, Vues panoramiques",-19.0,47.55,Banlieue sud Tana,Facile,1.5,0,0.0,Mai à octobre,4.3,100,Undiscovered Destinations,https://undiscovered-destinations.com/blog/ambohidrapeto-madagascar,Colline sacrée avec vues sur la capitale,Taxi,Aucune,2
380,Lac Masay,Analamanga,Antananarivo,Volcanisme et lacs,"Lac sacré, Pêche locale",-19.0,47.55,Sud d'Antananarivo,Facile,4.0,0,0.0,Avril à novembre,4.1,80,Adventure Life,https://www.adventure-life.com/madagascar/articles/lac-masay,Lac sacré entouré de légendes et pêche,Voiture,Aucune,2
381,Colline d'Ambohidrapeto,Analamanga,Antananarivo,Culture et histoire,"Site historique, Vues",-19.0,47.55,Banlieue sud,Facile,1.5,0,0.0,Mai à octobre,4.3,90,Tripzaza,https://www.tripzaza.com/en/destinations/ambohidrapeto-hill-madagascar,Colline historique avec vues panoramiques sur Tana,Taxi,Aucune,2
382,Université d'Antananarivo,Analamanga,Antananarivo,Culture et histoire,"Campus historique, Jardin botanique",-18.91,47.53,Centre Tana,Facile,1.0,0,0.0,Mai à octobre,4.2,150,Synotrip,https://www.synotrip.com/madagascar/university-antananarivo,Université avec jardin botanique et architecture coloniale,Taxi,Aucune,2
383,Jardin Botanique (Tsimbazaza),Analamanga,Antananarivo,Nature et parcs nationaux,"Flore endémique, Exposition",-18.93,47.53,Près du zoo Tsimbazaza,Facile,1.5,8000,1.6,Mai à octobre,4.1,200,Responsible Travel,https://www.responsibletravel.com/holidays/madagascar/travel-guide/tsimbazaza-botanical,Jardin avec flore malgache et expositions,Taxi,Aucune,2
384,Zones maraîchères Antananarivo,Analamanga,Antananarivo,Culture et histoire,"Cultures périurbaines, Marchés locaux",-18.91,47.53,Banlieues Tana,Facile,4.0,0,0.0,Toute l'année,4.0,100,Discover Africa,https://www.discoverafrica.com/blog/antananarivo-maracheres,Zones agricoles autour de la capitale avec marchés frais,Taxi-brousse,Aucune,2
385,Vue panoramique Antananarivo,Analamanga,Antananarivo,Géologie et paysages,Vues ville haute,-18.91,47.53,Ville haute Tana,Facile,0.5,0,0.0,Mai à octobre,4.5,500,Prime Uganda,https://www.primeugandasafaris.com/antananarivo-panoramic-views,Vues panoramiques depuis la ville haute sur la capitale,Marche ou taxi,Aucune,2
386,Colline d'Ambohimanga (zone palais),Analamanga,Ambohimanga,Sites UNESCO,"Palais royal, Site sacré",-18.76,47.56,Colline royale Ambohimanga,Facile,3.5,15000,3.0,Avril à novembre,4.7,800,Magnificent World,https://www.magnificentworld.com/ambohimanga-palace-madagascar,Palais royal sur colline sacrée UNESCO,Taxi-brousse depuis Tana,Aucune,5
387,Lac Mantasoa,Analamanga,Mantasoa,Volcanisme et lacs,"Lac artificiel, Picnics",-18.98,47.49,Près de Lemurs' Park,Facile,4.0,0,0.0,Avril à novembre,4.3,150,Eskapas Travel,https://eskapas.com/mantasoa-lake-madagascar,Lac artificiel pour picnics et détente,Voiture,Aucune,2
388,Rizières en terrasses Mantasoa,Analamanga,Mantasoa,Culture et histoire,"Rizières escalier, Paysages",-18.98,47.49,Autour du lac Mantasoa,Facile,1.5,0,0.0,Toute l'année,4.4,120,Helen in Wonderlust,https://www.heleninwonderlust.co.uk/mantasoa-rice-terraces-madagascar,Rizières en terrasses traditionnelles autour du lac,Voiture,Aucune,2
389,Village d'Ambohimanga Rova,Analamanga,Ambohimanga,Culture et histoire,Village royal historique,-18.76,47.56,Près de la colline Ambohimanga,Facile,2.5,0,0.0,Avril à novembre,4.5,200,That Travel,https://thattravel.co.uk/ambohimanga-rova-village,Village historique autour de la colline royale,Taxi-brousse,Aucune,2
390,Palais d'Andrianampoinimerina,Analamanga,Ambohimanga,Sites UNESCO,Palais historique dynastie Merina,-18.76,47.56,Sur la colline Ambohimanga,Facile,1.5,15000,3.0,Avril à novembre,4.7,600,Discover Africa,https://www.discoverafrica.com/blog/andrianampoinimerina-palace,Palais du roi Andrianampoinimerina sur site sacré,Taxi-brousse depuis Tana,Aucune,5
391,Site historique Merina Ambohimanga,Analamanga,Ambohimanga,Culture et histoire,Site dynastie Merina,-18.76,47.56,Colline Ambohimanga,Facile,1.5,0,0.0,Avril à novembre,4.6,300,Rhino Africa,https://www.rhinoafrica.com/en/destinations/madagascar/merina-site-ambohimanga,Site historique de la dynastie Merina,Taxi-brousse,Aucune,2
392,Agriculture périurbaine Tana,Analamanga,Antananarivo,Culture et histoire,Cultures autour Tana,-18.91,47.53,Banlieues agricoles Tana,Facile,4.0,0,0.0,Toute l'année,4.0,80,Undiscovered Destinations,https://undiscovered-destinations.com/blog/tana-periurban-agriculture,Zones agricoles périurbaines autour de la capitale,Taxi-brousse,Aucune,2
393,Vallée de l'Ikopa,Analamanga,Antananarivo,Nature et parcs nationaux,"Vallée rivière, Paysages",-18.85,47.6,Vallée Ikopa nord Tana,Facile,4.0,0,0.0,Avril à novembre,4.2,90,Adventure Life,https://www.adventure-life.com/madagascar/articles/ikopa-valley,Vallée fertile avec rivière Ikopa et paysages,Voiture,Aucune,2
394,Colline sacrée d'Ambohidratrimo,Analamanga,Ambohidratrimo,Sites UNESCO,"Colline sacrée, Site historique",-18.8,47.45,Près d'Ambohidratrimo,Facile,2.0,0,0.0,Avril à décembre,4.4,120,Responsible Travel,https://www.responsibletravel.com/holidays/madagascar/travel-guide/ambohidratrimo-hill,Colline sacrée avec traditions Merina,Voiture,Aucune,2
395,Rova d'Ambohidratrimo,Analamanga,Ambohidratrimo,Culture et histoire,Palais historique Rova,-18.8,47.45,Sur la colline Ambohidratrimo,Facile,1.0,0,0.0,Avril à décembre,4.3,100,Helen in Wonderlust,https://www.heleninwonderlust.co.uk/ambohidratrimo-rova-madagascar,Palais historique sur colline sacrée,Voiture,Aucune,2
396,Rizières traditionnelles Ambohidratrimo,Analamanga,Ambohidratrimo,Culture et histoire,Rizières en terrasses traditionnelles,-18.8,47.45,Autour d'Ambohidratrimo,Facile,1.5,0,0.0,Toute l'année,4.2,80,That Travel,https://thattravel.co.uk/ambohidratrimo-rice-terraces,Rizières traditionnelles en terrasses autour de la colline,Voiture,Aucune,2
397,Artisanat Ambohidratrimo,Analamanga,Ambohidratrimo,Artisanat et marchés,Artisanat local colline,-18.8,47.45,Village Ambohidratrimo,Facile,1.0,0,0.0,Avril à décembre,4.1,70,Discover Africa,https://www.discoverafrica.com/blog/ambohidratrimo-crafts,Artisanat local dans le village de la colline sacrée,Voiture,Aucune,2
398,Site historique Merina Ambohidratrimo,Analamanga,Ambohidratrimo,Culture et histoire,Site historique Merina,-18.8,47.45,Colline Ambohidratrimo,Facile,1.5,0,0.0,Avril à décembre,4.4,110,Rhino Africa,https://www.rhinoafrica.com/en/destinations/madagascar/merina-site-ambohidratrimo,Site historique de la dynastie Merina sur colline,Voiture,Aucune,2
399,Agriculture biologique Ambohidratrimo,Analamanga,Ambohidratrimo,Culture et histoire,Agriculture bio colline,-18.8,47.45,Autour Ambohidratrimo,Facile,4.0,0,0.0,Toute l'année,4.3,90,Undiscovered Destinations,https://undiscovered-destinations.com/blog/ambohidratrimo-organic-agriculture,Zones d'agriculture biologique autour de la colline,Voiture,Aucune,2
400,Vallées pastorales Ambohidratrimo,Analamanga,Ambohidratrimo,Nature et parcs nationaux,"Vallées, Élevage",-18.8,47.45,Vallées Ambohidratrimo,Facile,1.5,0,0.0,Avril à décembre,4.2,80,Adventure Life,https://www.adventure-life.com/madagascar/articles/ambohidratrimo-pastoral,Vallées pastorales avec élevage traditionnel,Voiture,Aucune,2
401,Traditions rurales Ambohidratrimo,Analamanga,Ambohidratrimo,Culture et histoire,Traditions rurales colline,-18.8,47.45,Village Ambohidratrimo,Facile,4.0,0,0.0,Avril à décembre,4.1,70,Prime Uganda,https://www.primeugandasafaris.com/ambohidratrimo-rural-traditions,Traditions rurales et vie quotidienne sur la colline,Voiture,Aucune,2
402,Vue hauts plateaux Ambohidratrimo,Analamanga,Ambohidratrimo,Géologie et paysages,Vue plateaux centraux,-18.8,47.45,Sommet Ambohidratrimo,Facile,0.5,0,0.0,Avril à décembre,4.4,100,Responsible Travel,https://www.responsibletravel.com/holidays/madagascar/travel-guide/ambohidratrimo-view,Vue panoramique sur les hauts plateaux depuis la colline,Voiture,Aucune,2
403,Sources thermales Ambohidratrimo,Analamanga,Ambohidratrimo,Thermalisme et bien-être,Sources thermales colline,-18.8,47.45,Près d'Ambohidratrimo,Facile,4.0,5000,1.0,Toute l'année,4.3,90,Helen in Wonderlust,https://www.heleninwonderlust.co.uk/ambohidratrimo-thermal-springs,Sources thermales naturelles près de la colline,Voiture,Aucune,2
404,Montagne de Manjakandriana,Analamanga,Manjakandriana,Géologie et paysages,"Montagne, Sources thermales",-18.92,47.8,Près de Manjakandriana,Moyen,8.0,8000,1.6,Avril à décembre,4.4,120,That Travel,https://thattravel.co.uk/manjakandriana-mountain,Montagne avec sources thermales et vues,Voiture,Sentiers escarpés,3
405,Rizières en escalier Manjakandriana,Analamanga,Manjakandriana,Culture et histoire,Rizières escalier,-18.92,47.8,Autour Manjakandriana,Facile,1.5,0,0.0,Toute l'année,4.3,100,Discover Africa,https://www.discoverafrica.com/blog/manjakandriana-rice-steps,Rizières en escalier traditionnelles,Voiture,Aucune,2
406,Village traditionnel Manjakandriana,Analamanga,Manjakandriana,Culture et histoire,Village typique Merina,-18.92,47.8,Village Manjakandriana,Facile,4.0,0,0.0,Avril à décembre,4.2,80,Rhino Africa,https://www.rhinoafrica.com/en/destinations/madagascar/manjakandriana-village,Village traditionnel avec architecture Merina,Voiture,Aucune,2
407,Agriculture biologique Manjakandriana,Analamanga,Manjakandriana,Culture et histoire,Agriculture bio,-18.92,47.8,Autour Manjakandriana,Facile,4.0,0,0.0,Toute l'année,4.1,70,Undiscovered Destinations,https://undiscovered-destinations.com/blog/manjakandriana-organic-agriculture,Zones d'agriculture biologique dans la région,Voiture,Aucune,2
408,Vallée de la Sisaony,Analamanga,Manjakandriana,Nature et parcs nationaux,"Vallée fertile, Rivières",-18.92,47.8,Vallée Sisaony,Facile,1.5,0,0.0,Avril à décembre,4.3,90,Adventure Life,https://www.adventure-life.com/madagascar/articles/sisaony-valley,Vallée fertile avec rivières et paysages verdoyants,Voiture,Aucune,2
409,Paysages volcaniques Manjakandriana,Analamanga,Manjakandriana,Géologie et paysages,Paysages volcaniques,-18.92,47.8,Autour Manjakandriana,Moyen,8.0,0,0.0,Avril à décembre,4.4,110,Prime Uganda,https://www.primeugandasafaris.com/manjakandriana-volcanic-landscapes,Paysages formés par activité volcanique ancienne,Voiture,Sentiers escarpés,2
410,Traditions Merina Manjakandriana,Analamanga,Manjakandriana,Culture et histoire,Traditions ancestrales Merina,-18.92,47.8,Village Manjakandriana,Facile,4.0,0,0.0,Avril à décembre,4.3,100,Responsible Travel,https://www.responsibletravel.com/holidays/madagascar/travel-guide/manjakandriana-merina,Traditions et rites ancestraux du peuple Merina,Voiture,Aucune,2
411,Corridor forestier d'Anjozorobe,Analamanga,Anjozorobe,Nature et parcs nationaux,"Corridor forestier, Biodiversité",-18.4,47.88,Près d'Anjozorobe,Moyen,8.0,15000,3.0,Avril à novembre,4.5,180,Helen in Wonderlust,https://www.heleninwonderlust.co.uk/anjozorobe-forest-corridor-madagascar,Corridor forestier protégé avec biodiversité riche,Voiture + guide,Sentiers humides,3
412,Forêt primaire Anjozorobe,Analamanga,Anjozorobe,Nature et parcs nationaux,"Forêt primaire, Observation lémuriens",-18.4,47.88,Forêt Anjozorobe,Moyen,8.0,15000,3.0,Avril à novembre,4.5,160,That Travel,https://thattravel.co.uk/anjozorobe-primary-forest,Forêt primaire intacte avec lémuriens et oiseaux,Voiture + guide,Sentiers humides,3
413,Observatoire d'oiseaux Anjozorobe,Analamanga,Anjozorobe,Observation animalière,"Oiseaux endémiques, Forêt",-18.4,47.88,Zone oiseaux Anjozorobe,Facile,2.5,15000,3.0,Avril à novembre,4.6,140,Discover Africa,https://www.discoverafrica.com/blog/anjozorobe-bird-observatory,Spot d'observation d'oiseaux endémiques dans la forêt,Voiture + guide,Aucune,2
414,Rivière Anjozorobe,Analamanga,Anjozorobe,Nature et parcs nationaux,"Rivière, Paysages fluviaux",-18.4,47.88,Rivière Anjozorobe,Facile,1.5,0,0.0,Avril à novembre,4.4,120,Rhino Africa,https://www.rhinoafrica.com/en/destinations/madagascar/anjozorobe-river,Rivière traversant la forêt avec paysages,Voiture + pirogue,Aucune,2
415,Biodiversité endémique Anjozorobe,Analamanga,Anjozorobe,Observation animalière,Biodiversité unique,-18.4,47.88,Corridor Anjozorobe,Moyen,8.0,15000,3.0,Avril à novembre,4.5,130,Undiscovered Destinations,https://undiscovered-destinations.com/blog/anjozorobe-endemic-biodiversity,Biodiversité endémique riche dans le corridor forestier,Voiture + guide,Sentiers humides,3
416,Écotourisme Anjozorobe,Analamanga,Anjozorobe,Écotourisme,Écotourisme communautaire,-18.4,47.88,Village Anjozorobe,Facile,4.0,15000,3.0,Avril à novembre,4.4,110,Adventure Life,https://www.adventure-life.com/madagascar/articles/anjozorobe-ecotourism,Écotourisme géré par communauté locale,Voiture,Aucune,2
417,Village écologique Anjozorobe,Analamanga,Anjozorobe,Culture et histoire,Village éco-responsable,-18.4,47.88,Village Anjozorobe,Facile,4.0,0,0.0,Avril à novembre,4.3,100,Prime Uganda,https://www.primeugandasafaris.com/anjozorobe-ecovillage,Village écologique avec pratiques durables,Voiture,Aucune,2
418,Randonnée nature Anjozorobe,Analamanga,Anjozorobe,Aventure et randonnée,Sentiers randonnée forêt,-18.4,47.88,Sentiers Anjozorobe,Moyen,8.0,15000,3.0,Avril à novembre,4.5,120,Responsible Travel,https://www.responsibletravel.com/holidays/madagascar/travel-guide/anjozorobe-hiking,Randonnées nature dans le corridor forestier,Voiture + guide,Sentiers humides,3
419,Parc National d'Ankazobe,Analamanga,Ankazobe,Nature et parcs nationaux,"Paysages Ankazobe, Élevage",-18.32,47.12,Région Ankazobe,Moyen,8.0,20000,4.0,Septembre à mai,4.4,140,Helen in Wonderlust,https://www.heleninwonderlust.co.uk/ankazobe-national-park-madagascar,Parc avec paysages variés et élevage zébus,Voiture,Sentiers escarpés,3
420,Paysages d'Ankazobe,Analamanga,Ankazobe,Géologie et paysages,Paysages vallonnés,-18.32,47.12,Autour d'Ankazobe,Facile,4.0,0,0.0,Septembre à mai,4.3,120,That Travel,https://thattravel.co.uk/ankazobe-landscapes,Paysages vallonnés et collines rocheuses,Voiture,Aucune,2
421,Parc National de Zombitse (zone nord),Atsimo-Andrefana,Sakaraha,Nature et parcs nationaux,"Forêt transition nord, Avifaune",-22.8,44.75,Nord de Zombitse,Moyen,4.0,15000,3.0,Mai à novembre,4.5,130,SafariBookings,https://www.safaribookings.com/parks/zombitse-vohibasia-national-park,Zone nord avec oiseaux endémiques et forêt de transition,Voiture depuis Toliara,Aucune,1
422,Tsingy de Bemaraha (zone sud),Melaky,Antsalova,Géologie et paysages,"Tsingy sud, Grottes et ponts",-19.0,44.85,Sud du parc Tsingy Bemaraha,Difficile,8.0,35000,7.0,Juin à septembre,4.8,850,Lonely Planet,https://www.lonelyplanet.com/madagascar/attractions/tsingy-de-bemaraha,Zone sud des tsingy avec grottes et ponts naturels,4x4 + guide,Terrains karstiques,3
423,Plage d'Ambonivato (extension),Atsinanana,Toamasina,Plages et littoral,Plage extension Ambonivato,-18.1,49.35,Extension sud Ambonivato,Facile,3.0,0,0.0,Avril à novembre,4.2,130,TripAdvisor,https://www.tripadvisor.com/Attraction_Review-g316110-d614310-Reviews-Ambonivato_Extension-Toamasina_Tamatave_Toamasina_Province.html,Extension sauvage de la plage Ambonivato,Taxi ou tuk-tuk,Aucune,2
424,Canal des Pangalanes (section Vatomandry),Atsinanana,Vatomandry,Nature et parcs nationaux,"Canal sud, Mangroves, Villages",-19.3333,48.9833,Section Vatomandry sur le canal,Moyen,8.0,15000,3.0,Avril à décembre,4.3,160,Audley Travel,https://www.audleytravel.com/madagascar/places-to-go/pangalanes-vatomandry,Section sud du canal avec mangroves et villages côtiers,Pirogue ou bateau,Insectes,3
425,Parc National de Midongy du Sud (zone montagne),Anosy,Midongy Atsimo,Nature et parcs nationaux,"Montagnes Midongy, Forêt isolée",-23.7,47.15,Zone montagne Midongy,Difficile,8.0,22000,4.4,Juillet à octobre,4.6,85,Lonely Planet,https://www.lonelyplanet.com/madagascar/attractions/midongy-du-sud,Zone montagneuse avec forêt isolée et biodiversité,4x4 + randonnée,Accès très difficile,3
426,Réserve de Kalalao (zone oiseaux),Analanjirofo,Ambodifotatra,Observation animalière,"Oiseaux Kalalao, Forêt littorale",-17.0333,49.8167,Zone oiseaux Kalalao,Facile,2.5,12000,2.4,Juin à septembre,4.5,150,SafariBookings,https://www.safaribookings.com/reserves/kalalao-sainte-marie,Zone observation oiseaux dans la réserve Kalalao,Taxi ou marche locale,Aucune,0
427,Parc National de Namoroka (zone lac),Melaky,Soalala,Nature et parcs nationaux,"Lac Namoroka, Forêt sèche",-16.4667,45.3167,Zone lac Namoroka,Moyen,8.0,25000,5.0,Juin à septembre,4.7,110,Audley Travel,https://www.audleytravel.com/madagascar/places-to-go/namoroka-national-park,Zone lac avec forêt sèche et tsingy,4x4 + guide,Terrains rocheux,3
428,Plage de Mahambo (zone surf),Analanjirofo,Mahambo,Plages et littoral,Zone surf Mahambo,-17.4833,49.45,Zone surf Mahambo,Facile,2.5,0,0.0,Mai à octobre,4.4,240,TripAdvisor,https://www.tripadvisor.com/Attraction_Review-g316110-d614311-Reviews-Mahambo_Surf-Madagascar.html,Zone surf réputée sur plage Mahambo,Taxi-brousse depuis Toamasina,Vagues,0
429,Réserve de Tampolo (zone recherche),Analanjirofo,Fenoarivo Atsinanana,Écotourisme,Zone recherche Tampolo,-17.3667,49.4167,Zone station recherche Tampolo,Facile,2.5,12000,2.4,Mai à octobre,4.3,110,Lonely Planet,https://www.lonelyplanet.com/madagascar/attractions/tampolo-reserve,Zone de recherche écologique et forêt littorale,Voiture ou taxi-brousse,Aucune,0
