id_site,nom,region,ville_commune,type_activite,sous_types_tags,latitude,longitude,adresse_ou_description_localisation,difficulte,duree_typique_visite,prix_approximatif_ar,prix_approximatif_eur,saison_recommandee,note_moyenne,nombre_avis,source_note,lien_page,description_courte,acces_transport,contraintes,cluster
286,Forêt de Mikea (zone nomades),Atsimo-Andrefana,Manja,Culture et histoire,"Peuple Mikea, Mode de vie nomade",-22.5,43.5,Zone nomades Mikea,Moyen,8.0,25000,5.0,Avril à décembre,4.5,110,Audley Travel,https://www.audleytravel.com/madagascar/places-to-go/mikea-forest,Immersion avec le peuple Mikea semi-nomade dans la forêt sèche,4x4 + guide,Accès difficile,1
287,Parc National de Tsimanampetsotsa (zone forêt épineuse),Atsimo-Andrefana,Betioky Sud,Nature et parcs nationaux,"Forêt épineuse, Tortues, Baobabs",-24.1,43.75,Zone épineuse du parc,Moyen,8.0,20000,4.0,Avril à décembre,4.6,250,SafariBookings,https://www.safaribookings.com/parks/tsimanampetsotse-national-park,Forêt épineuse avec tortues radiées et baobabs,4x4 depuis Toliara,Chaleur extrême,1
288,Réserve de Beza-Mahafaly (zone Parcelle 2),Atsimo-Andrefana,Betioky Sud,Observation animalière,"Parcelle 2, Lémuriens, Reptiles",-23.65,44.6333,Parcelle 2 de Beza-Mahafaly,Moyen,4.0,15000,3.0,Avril à décembre,4.5,130,Lonely Planet,https://www.lonelyplanet.com/madagascar/attractions/beza-mahafaly,Zone secondaire avec observation lémuriens et reptiles,Voiture + guide,Aucune,1
289,Plage de Lokaro (zone isolée nord),Analanjirofo,Foulpointe,Plages et littoral,"Plage nord isolée, Excursion bateau",-17.05,49.9833,Nord de Lokaro,Facile,4.0,20000,4.0,Mai à octobre,4.6,200,TripAdvisor,https://www.tripadvisor.com/Attraction_Review-g316110-d614292-Reviews-Northern_Lokaro_Beach-Madagascar.html,Extension nord isolée de la plage Lokaro,Bateau depuis Foulpointe,Aucune,0
290,Lac Anony (zone flamants),Anosy,Amboasary Sud,Observation animalière,"Flamants roses, Zones humides",-25.0833,46.95,Zone flamants du lac Anony,Facile,1.5,0,0.0,Mai à novembre,4.4,150,Audley Travel,https://www.audleytravel.com/madagascar/places-to-go/lac-anony,Zone observation flamants roses sur lac salé,Voiture depuis Taolagnaro,Soleil intense,6
291,Parc National d'Andringitra (zone vallée),Haute Matsiatra,Ambalavao,Nature et parcs nationaux,"Vallée granitique, Rivières",-22.1833,46.9667,Vallée d'Andringitra,Moyen,8.0,30000,6.0,Avril à novembre,4.7,280,SafariBookings,https://www.safaribookings.com/parks/andringitra-national-park,Vallée spectaculaire avec rivières et formations granitiques,Voiture + randonnée,Randonnée physique,3
292,Réserve d'Anja (zone lac),Haute Matsiatra,Ambalavao,Nature et parcs nationaux,"Petit lac, Lémuriens, Rochers",-21.8333,46.9333,Zone lac d'Anja,Facile,1.5,10000,2.0,Mai à octobre,4.6,900,Lonely Planet,https://www.lonelyplanet.com/madagascar/attractions/anja-reserve,Petit lac entouré de rochers avec makis catta,Voiture depuis Ambalavao,Aucune,5
293,Train FCE (zone Fianarantsoa haute),Haute Matsiatra,Fianarantsoa,Culture et histoire,"Vieille ville, Vignobles depuis train",-21.4536,47.0858,Zone haute Fianarantsoa,Facile,1.5,0,0.0,Mai à octobre,4.5,400,TripAdvisor,https://www.tripadvisor.com/Attraction_Review-g298290-d614293-Reviews-Fianarantsoa_Upper_Town-Madagascar.html,Vue sur vieille ville et vignobles depuis le train,Train ou taxi,Aucune,2
294,Sources thermales Antsirabe (zone moderne),Vakinankaratra,Antsirabe,Thermalisme et bien-être,Centre thermal moderne,-19.8667,47.0333,Zone moderne Antsirabe,Facile,4.0,12000,2.4,Toute l'année,4.4,250,Audley Travel,https://www.audleytravel.com/madagascar/places-to-go/antsirabe-thermal,Centre thermal récent avec piscines et soins,Taxi ou marche,Aucune,2
295,Lac Andraikiba (zone nautique),Vakinankaratra,Antsirabe,Volcanisme et lacs,"Activités nautiques, Pédalos",-19.9167,47.0667,Zone nautique du lac,Facile,2.5,0,0.0,Avril à novembre,4.4,220,TripAdvisor,https://www.tripadvisor.com/Attraction_Review-g298279-d614294-Reviews-Andraikiba_Lake-Madagascar.html,Zone avec pédalos et activités sur le lac de cratère,Voiture ou taxi,Aucune,2
296,Betafo rizières (zone UNESCO),Vakinankaratra,Betafo,Culture et histoire,Rizières en terrasses classées UNESCO,-19.8333,46.85,Zone UNESCO Betafo,Facile,2.5,0,0.0,Toute l'année,4.5,300,Lonely Planet,https://www.lonelyplanet.com/madagascar/attractions/betafo-rice-terraces,Rizières en escalier classées patrimoine mondial,Voiture ou taxi,Aucune,2
297,Lac Itasy (zone volcans),Itasy,Arivonimamo,Géologie et paysages,"Volcans éteints, Paysages lunaires",-19.1667,46.7333,Zone volcans du lac Itasy,Moyen,2.5,8000,1.6,Avril à novembre,4.4,160,SafariBookings,https://www.safaribookings.com/blog/lac-itasy-volcanoes,Zone volcanique avec paysages lunaires autour du lac,Voiture + randonnée,Sentiers escarpés,2
298,Chute de la Lily (zone supérieure),Itasy,Arivonimamo,Nature et parcs nationaux,"Cascade supérieure, Forêt environnante",-19.0333,46.8,Zone haute de la chute Lily,Facile,1.5,5000,1.0,Avril à novembre,4.4,130,Audley Travel,https://www.audleytravel.com/madagascar/places-to-go/lily-falls,Partie supérieure de la cascade avec forêt,Voiture + courte marche,Sentier glissant,2
299,Massif Tsaratanana (zone base),Betsiboka,Bealanana,Aventure et randonnée,Base ascension Maromokotro,-16.7833,47.65,Zone base du massif,Difficile,,40000,8.0,Avril à novembre,4.8,70,Lonely Planet,https://www.lonelyplanet.com/madagascar/attractions/tsaratanana-massif,Zone départ pour ascension du plus haut sommet de Madagascar,Expédition guidée + 4x4,Altitude élevée,4
300,Pic Saint-Louis (zone panorama),Anosy,Taolagnaro,Aventure et randonnée,Panorama complet sur Fort Dauphin,-25.05,46.9833,Zone sommet Pic Saint-Louis,Moyen,2.0,5000,1.0,Mai à novembre,4.5,200,TripAdvisor,https://www.tripadvisor.com/Attraction_Review-g298283-d614295-Reviews-Pic_Saint_Louis-Madagascar.html,Point de vue 360° sur la ville et l'océan,Voiture + randonnée,Soleil intense,6
301,Plage Libanona (zone surf),Anosy,Taolagnaro,Plages et littoral,"Zone surf, Vagues régulières",-25.0318,46.9993,Zone surf de Libanona,Facile,2.5,0,0.0,Mai à novembre,4.4,300,Audley Travel,https://www.audleytravel.com/madagascar/places-to-go/libanona-beach,Partie plage idéale pour surf et baignade,Marche ou taxi local,Vagues,6
302,Rivière Onilahy (zone canyons),Atsimo-Andrefana,Betioky Sud,Géologie et paysages,"Canyons Onilahy, Crocodiles",-21.6667,45.1667,Zone canyons de l'Onilahy,Moyen,1.5,0,0.0,Avril à décembre,4.3,110,Lonely Planet,https://www.lonelyplanet.com/madagascar/attractions/onilahy-river,Canyons spectaculaires le long du fleuve,Voiture + pirogue,Courants,6
303,Oasis Amboasary Sud (zone village),Anosy,Amboasary Sud,Culture et histoire,"Village oasis, Artisanat local",-25.0333,46.3833,Zone village oasis,Facile,2.0,8000,1.6,Mai à octobre,4.2,80,SafariBookings,https://www.safaribookings.com/blog/amboasary-oasis-village,Village authentique avec cultures et artisanat en oasis,Voiture depuis Taolagnaro,Chaleur,6
304,Mines Ilakaka (zone extraction),Ihorombe,Ilakaka,Culture et histoire,Zones extraction artisanale,-22.7667,45.2333,Zones mines Ilakaka,Facile,1.5,0,0.0,Toute l'année,4.1,140,Audley Travel,https://www.audleytravel.com/madagascar/places-to-go/ilakaka-mines,Zones d'extraction artisanale de saphirs,Voiture + guide local,Sécurité minière,6
305,Forêt Mikea (zone campements),Atsimo-Andrefana,Manja,Culture et histoire,"Campements Mikea, Chasse traditionnelle",-22.5,43.5,Zone campements Mikea,Moyen,8.0,25000,5.0,Avril à décembre,4.5,100,Lonely Planet,https://www.lonelyplanet.com/madagascar/attractions/mikea-forest,Campements semi-nomades du peuple Mikea,4x4 + guide,Accès difficile,1
306,Tsimanampetsotsa (zone baobabs),Atsimo-Andrefana,Betioky Sud,Nature et parcs nationaux,"Baobabs, Forêt épineuse",-24.1,43.75,Zone baobabs du parc,Moyen,8.0,20000,4.0,Avril à décembre,4.6,220,TripAdvisor,https://www.tripadvisor.com/Attraction_Review-g298288-d614296-Reviews-Tsimanampetsotse_Baobabs-Madagascar.html,Zone avec baobabs et forêt épineuse,4x4 depuis Toliara,Chaleur extrême,1
307,Beza-Mahafaly (zone Parcelle 3),Atsimo-Andrefana,Betioky Sud,Observation animalière,"Parcelle 3, Reptiles, Oiseaux",-23.65,44.6333,Parcelle 3 de Beza-Mahafaly,Moyen,4.0,15000,3.0,Avril à décembre,4.5,110,Audley Travel,https://www.audleytravel.com/madagascar/places-to-go/beza-mahafaly,Zone tertiaire avec reptiles et oiseaux,Voiture + guide,Aucune,1
308,Plage Lokaro (zone sud),Analanjirofo,Foulpointe,Plages et littoral,"Plage sud isolée, Excursion pirogue",-17.15,49.9833,Sud de Lokaro,Facile,4.0,20000,4.0,Mai à octobre,4.6,180,Lonely Planet,https://www.lonelyplanet.com/madagascar/attractions/lokaro-beach,Extension sud sauvage de Lokaro,Bateau depuis Foulpointe,Aucune,0
309,Lac Anony (zone cordon littoral),Anosy,Amboasary Sud,Nature et parcs nationaux,"Cordon littoral, Flamants, Lagune",-25.0833,46.95,Zone cordon du lac Anony,Facile,1.5,0,0.0,Mai à novembre,4.4,130,SafariBookings,https://www.safaribookings.com/blog/lac-anony-madagascar,Cordon reliant lac salé et mer avec flamants,Voiture depuis Taolagnaro,Soleil intense,6
310,Andringitra (zone camping),Haute Matsiatra,Ambalavao,Aventure et randonnée,"Zones camping, Randonnée multi-jours",-22.2,46.8833,Zones camping Andringitra,Difficile,,30000,6.0,Avril à novembre,4.8,250,TripAdvisor,https://www.tripadvisor.com/Attraction_Review-g298278-d614297-Reviews-Andringitra_Camping-Madagascar.html,Zones camping pour randonnées multi-jours dans le massif,Guide + équipement camping,Altitude et froid,3
311,Anja (zone village communautaire),Haute Matsiatra,Ambalavao,Culture et histoire,"Village communautaire, Gestion locale",-21.8333,46.9333,Village gestion Anja,Facile,1.5,10000,2.0,Mai à octobre,4.7,700,Audley Travel,https://www.audleytravel.com/madagascar/places-to-go/anja-community,Village communautaire gérant la réserve,Voiture depuis Ambalavao,Aucune,5
312,Train FCE (zone rizières),Haute Matsiatra,Fianarantsoa,Culture et histoire,Rizières vues depuis train,-21.4536,47.0858,Zone rizières sur trajet FCE,Facile,1.5,0,0.0,Mai à octobre,4.5,380,Lonely Planet,https://www.lonelyplanet.com/madagascar/attractions/fce-rice-fields,Paysages de rizières en terrasses depuis le train,Train,Retards possibles,2
313,Sources thermales Antsirabe (zone bains publics),Vakinankaratra,Antsirabe,Thermalisme et bien-être,Bains publics thermaux,-19.8667,47.0333,Zone bains publics Antsirabe,Facile,4.0,5000,1.0,Toute l'année,4.3,300,TripAdvisor,https://www.tripadvisor.com/Attraction_Review-g298279-d614298-Reviews-Public_Thermal_Baths-Antsirabe_Antananarivo_Province.html,Bains publics naturels et populaires,Taxi ou marche,Aucune,2
314,Lac Andraikiba (zone pique-nique),Vakinankaratra,Antsirabe,Nature et parcs nationaux,Zone pique-nique lacustre,-19.9167,47.0667,Zone pique-nique Andraikiba,Facile,2.5,0,0.0,Avril à novembre,4.4,200,Audley Travel,https://www.audleytravel.com/madagascar/places-to-go/andraikiba-lake,Zone aménagée pour pique-nique autour du lac,Voiture ou taxi,Aucune,2
315,Betafo (zone village traditionnel),Vakinankaratra,Betafo,Culture et histoire,"Village traditionnel, Artisanat",-19.8333,46.85,Village Betafo,Facile,2.5,0,0.0,Toute l'année,4.5,280,Lonely Planet,https://www.lonelyplanet.com/madagascar/attractions/betafo-village,Village traditionnel avec rizières et artisanat,Voiture ou taxi,Aucune,2
316,Lac Itasy (zone cascades),Itasy,Arivonimamo,Nature et parcs nationaux,Cascades autour du lac,-19.0667,46.7833,Zone cascades Itasy,Facile,4.0,0,0.0,Avril à novembre,4.3,170,SafariBookings,https://www.safaribookings.com/blog/lac-itasy-cascades,Cascades et rivières autour du lac volcanique,Voiture + courte marche,Sentiers humides,2
317,Chute de la Lily (zone forêt),Itasy,Arivonimamo,Nature et parcs nationaux,Forêt environnante cascade,-19.0333,46.8,Zone forêt Lily,Facile,1.5,5000,1.0,Avril à novembre,4.4,120,TripAdvisor,https://www.tripadvisor.com/Attraction_Review-g298282-d614299-Reviews-Lily_Forest-Madagascar.html,Forêt dense autour de la chute Lily,Voiture + marche,Sentier glissant,2
318,Massif Tsaratanana (zone forêts),Betsiboka,Bealanana,Nature et parcs nationaux,Forêts humides Tsaratanana,-16.7833,47.65,Zone forêts du massif,Difficile,,40000,8.0,Avril à novembre,4.8,60,Audley Travel,https://www.audleytravel.com/madagascar/places-to-go/tsaratanana-forests,Forêts humides autour du plus haut sommet,Expédition guidée,Altitude et logistique,4
319,Pic Saint-Louis (zone base),Anosy,Taolagnaro,Aventure et randonnée,Base randonnée Pic Saint-Louis,-25.05,46.9833,Zone base du pic,Moyen,2.0,5000,1.0,Mai à novembre,4.5,180,Lonely Planet,https://www.lonelyplanet.com/madagascar/attractions/pic-saint-louis,Zone départ pour ascension et panorama,Voiture + randonnée,Soleil intense,6
320,Plage Libanona (zone nord),Anosy,Taolagnaro,Plages et littoral,Zone nord plage Libanona,-25.0318,46.9993,Nord de Libanona,Facile,2.5,0,0.0,Mai à novembre,4.4,260,TripAdvisor,https://www.tripadvisor.com/Attraction_Review-g298283-d614300-Reviews-Northern_Libanona_Beach-Madagascar.html,Extension nord de la plage urbaine de Fort Dauphin,Marche ou taxi local,Aucune,6
321,Parc National de Ranomafana (zone Bambou),Haute Matsiatra,Ranomafana,Nature et parcs nationaux,"Forêt de bambou, Lémuriens dorés",-21.25,47.45,Zone bambou Ranomafana,Moyen,3.5,25000,5.0,Avril à novembre,4.6,520,Lonely Planet,https://www.lonelyplanet.com/madagascar/attractions/ranomafana-bamboo,Forêt de bambou avec lémuriens dorés et sentiers accessibles,Voiture + guide,Sentiers humides,3
322,Réserve d'Anja (zone village),Haute Matsiatra,Ambalavao,Culture et histoire,"Village communautaire, Gestion locale",-21.8333,46.9333,Village Anja,Facile,1.5,10000,2.0,Mai à octobre,4.7,800,Audley Travel,https://www.audleytravel.com/madagascar/places-to-go/anja-community,Village gérant la réserve avec rencontres locales,Voiture depuis Ambalavao,Aucune,5
323,Train FCE (zone Mananjary),Vatovavy-Fitovinany,Mananjary,Culture et histoire,"Architecture coloniale, Port Mananjary",-21.2167,48.3333,Zone Mananjary sur trajet FCE,Facile,1.5,0,0.0,Mai à octobre,4.4,290,TripAdvisor,https://www.tripadvisor.com/Attraction_Review-g298291-d614301-Reviews-Mananjary_Station-Madagascar.html,Architecture coloniale et port vus depuis le train,Train,Retards possibles,2
324,Vignobles Ambalavao (zone dégustation),Haute Matsiatra,Ambalavao,Gastronomie et vignobles,"Dégustation, Domaines locaux",-21.8333,46.9333,Zone dégustation vignobles,Facile,1.5,8000,1.6,Mai à octobre,4.4,220,Lonely Planet,https://www.lonelyplanet.com/madagascar/attractions/ambalavao-wine,Dégustation de vins malgaches dans les domaines,Voiture,Aucune,2
325,Sources thermales Antsirabe (zone spa),Vakinankaratra,Antsirabe,Thermalisme et bien-être,"Spa thermal, Soins modernes",-19.8667,47.0333,Zone spa Antsirabe,Facile,4.0,15000,3.0,Toute l'année,4.4,280,Audley Travel,https://www.audleytravel.com/madagascar/places-to-go/antsirabe-spa,Centre spa avec soins à base d’eau thermale,Taxi ou marche,Aucune,2
326,Lac Andraikiba (zone randonnée),Vakinankaratra,Antsirabe,Nature et parcs nationaux,Sentiers autour du lac,-19.9167,47.0667,Zone randonnée Andraikiba,Facile,2.5,0,0.0,Avril à novembre,4.4,190,TripAdvisor,https://www.tripadvisor.com/Attraction_Review-g298279-d614302-Reviews-Andraikiba_Trails-Madagascar.html,Sentiers pédestres autour du lac de cratère,Voiture ou taxi,Aucune,2
327,Betafo (zone thermes),Vakinankaratra,Betafo,Thermalisme et bien-être,Sources thermales Betafo,-19.8333,46.85,Zone thermes Betafo,Facile,4.0,5000,1.0,Toute l'année,4.3,210,Lonely Planet,https://www.lonelyplanet.com/madagascar/attractions/betafo-thermal,Sources thermales naturelles dans village traditionnel,Voiture ou taxi,Aucune,2
328,Lac Itasy (zone pêche),Itasy,Arivonimamo,Nature et parcs nationaux,"Pêche locale, Oiseaux",-19.0667,46.7833,Zone pêche du lac Itasy,Facile,4.0,0,0.0,Avril à novembre,4.3,140,SafariBookings,https://www.safaribookings.com/blog/lac-itasy-fishing,Zone pêche traditionnelle sur le lac volcanique,Voiture ou pirogue,Aucune,2
329,Chute de la Lily (zone pique-nique),Itasy,Arivonimamo,Nature et parcs nationaux,Zone pique-nique cascade,-19.0333,46.8,Zone pique-nique Lily,Facile,1.5,5000,1.0,Avril à novembre,4.4,110,Audley Travel,https://www.audleytravel.com/madagascar/places-to-go/lily-falls,Espace aménagé pour pique-nique près de la chute,Voiture + courte marche,Sentier glissant,2
330,Massif Tsaratanana (zone faune),Betsiboka,Bealanana,Observation animalière,"Lémuriens, Oiseaux de montagne",-16.7833,47.65,Zone faune Tsaratanana,Difficile,,40000,8.0,Avril à novembre,4.8,50,Lonely Planet,https://www.lonelyplanet.com/madagascar/attractions/tsaratanana-fauna,Zone riche en faune endémique de haute altitude,Expédition guidée,Altitude élevée,4
331,Pic Saint-Louis (zone coucher soleil),Anosy,Taolagnaro,Aventure et randonnée,Point de vue coucher de soleil,-25.05,46.9833,Zone sommet Pic Saint-Louis,Moyen,2.0,5000,1.0,Mai à novembre,4.5,170,TripAdvisor,https://www.tripadvisor.com/Attraction_Review-g298283-d614303-Reviews-Pic_Saint_Louis_Sunset-Madagascar.html,Spot idéal pour coucher de soleil sur l’océan,Voiture + randonnée,Soleil intense,6
332,Plage Libanona (zone baignade),Anosy,Taolagnaro,Plages et littoral,Zone baignade plage Libanona,-25.0318,46.9993,Zone baignade Libanona,Facile,2.5,0,0.0,Mai à novembre,4.4,240,Audley Travel,https://www.audleytravel.com/madagascar/places-to-go/libanona-beach,Zone calme pour baignade sur la plage urbaine,Marche ou taxi local,Aucune,6
333,Rivière Onilahy (zone villages),Atsimo-Andrefana,Betioky Sud,Culture et histoire,Villages riverains Onilahy,-21.6667,45.1667,Villages le long de l’Onilahy,Facile,1.5,0,0.0,Avril à décembre,4.3,100,Lonely Planet,https://www.lonelyplanet.com/madagascar/attractions/onilahy-villages,Rencontres avec communautés riveraines,Voiture + pirogue,Aucune,6
334,Oasis Amboasary Sud (zone marché),Anosy,Amboasary Sud,Artisanat et marchés,Marché local oasis,-25.0333,46.3833,Marché Amboasary Sud,Facile,2.0,8000,1.6,Mai à octobre,4.2,70,SafariBookings,https://www.safaribookings.com/blog/amboasary-market,Marché local avec produits oasis et artisanat,Voiture depuis Taolagnaro,Chaleur,6
335,Mines Ilakaka (zone tri),Ihorombe,Ilakaka,Culture et histoire,Zones tri et commerce saphirs,-22.7667,45.2333,Zone tri des saphirs Ilakaka,Facile,1.5,0,0.0,Toute l'année,4.1,130,Audley Travel,https://www.audleytravel.com/madagascar/places-to-go/ilakaka-sapphire-trade,Zones de tri et commerce des saphirs artisanaux,Voiture + guide local,Sécurité minière,6
336,Forêt Mikea (zone flore),Atsimo-Andrefana,Manja,Nature et parcs nationaux,Plantes endémiques Mikea,-22.5,43.5,Zone flore de la forêt Mikea,Moyen,8.0,25000,5.0,Avril à décembre,4.5,90,Lonely Planet,https://www.lonelyplanet.com/madagascar/attractions/mikea-flora,Zone riche en plantes endémiques de la forêt épineuse,4x4 + guide,Accès difficile,1
337,Tsimanampetsotsa (zone grotte),Atsimo-Andrefana,Betioky Sud,Géologie et paysages,Grottes Tsimanampetsotsa,-24.1,43.75,Zone grottes du parc,Moyen,8.0,20000,4.0,Avril à décembre,4.6,200,TripAdvisor,https://www.tripadvisor.com/Attraction_Review-g298288-d614304-Reviews-Tsimanampetsotse_Caves-Madagascar.html,Grottes calcaires dans le parc Tsimanampetsotsa,4x4 depuis Toliara,Chaleur extrême,1
338,Beza-Mahafaly (zone Parcelle 4),Atsimo-Andrefana,Betioky Sud,Observation animalière,"Parcelle 4, Oiseaux, Reptiles",-23.65,44.6333,Parcelle 4 de Beza-Mahafaly,Moyen,4.0,15000,3.0,Avril à décembre,4.5,100,Audley Travel,https://www.audleytravel.com/madagascar/places-to-go/beza-mahafaly,Zone supplémentaire pour oiseaux et reptiles,Voiture + guide,Aucune,1
339,Plage Lokaro (zone mangrove),Analanjirofo,Foulpointe,Nature et parcs nationaux,Mangroves Lokaro,-17.1,49.9833,Zone mangrove Lokaro,Facile,4.0,20000,4.0,Mai à octobre,4.6,170,Lonely Planet,https://www.lonelyplanet.com/madagascar/attractions/lokaro-mangroves,Zone mangrove près de la plage Lokaro,Bateau depuis Foulpointe,Insectes,0
340,Lac Anony (zone observation),Anosy,Amboasary Sud,Observation animalière,Observation oiseaux lac Anony,-25.0833,46.95,Zone observation lac Anony,Facile,1.5,0,0.0,Mai à novembre,4.4,120,SafariBookings,https://www.safaribookings.com/blog/lac-anony-birdwatching,Spot observation oiseaux sur lac salé,Voiture depuis Taolagnaro,Soleil intense,6
341,Andringitra (zone rivières),Haute Matsiatra,Ambalavao,Nature et parcs nationaux,Rivières Andringitra,-22.2,46.8833,Zone rivières du massif,Moyen,8.0,30000,6.0,Avril à novembre,4.7,240,TripAdvisor,https://www.tripadvisor.com/Attraction_Review-g298278-d614305-Reviews-Andringitra_Rivers-Madagascar.html,Rivières et gorges dans le massif granitique,Voiture + randonnée,Randonnée physique,3
342,Anja (zone lémuriens),Haute Matsiatra,Ambalavao,Observation animalière,Troupeaux lémuriens catta,-21.8333,46.9333,Zone lémuriens Anja,Facile,2.5,10000,2.0,Mai à octobre,4.8,2100,Audley Travel,https://www.audleytravel.com/madagascar/places-to-go/anja-lemurs,Troupeaux de lémuriens catta très proches des visiteurs,Voiture depuis Ambalavao,Aucune,5
343,Train FCE (zone forêt),Haute Matsiatra,Fianarantsoa,Nature et parcs nationaux,Forêt vue depuis train,-21.4536,47.0858,Zone forêt sur trajet FCE,Facile,1.5,0,0.0,Mai à octobre,4.5,350,Lonely Planet,https://www.lonelyplanet.com/madagascar/attractions/fce-forest,Passage à travers forêt tropicale depuis le train,Train,Retards possibles,2
344,Sources thermales Antsirabe (zone extérieur),Vakinankaratra,Antsirabe,Thermalisme et bien-être,Bains extérieurs thermaux,-19.8667,47.0333,Zone bains extérieurs Antsirabe,Facile,4.0,8000,1.6,Toute l'année,4.3,260,TripAdvisor,https://www.tripadvisor.com/Attraction_Review-g298279-d614306-Reviews-Open_Air_Thermal_Baths-Antsirabe_Antananarivo_Province.html,Bains thermaux en plein air naturels,Taxi ou marche,Aucune,2
345,Lac Andraikiba (zone observation),Vakinankaratra,Antsirabe,Nature et parcs nationaux,Observation oiseaux lac,-19.9167,47.0667,Zone oiseaux Andraikiba,Facile,2.5,0,0.0,Avril à novembre,4.4,180,Audley Travel,https://www.audleytravel.com/madagascar/places-to-go/andraikiba-lake,Observation oiseaux autour du lac de cratère,Voiture ou taxi,Aucune,2
346,Betafo (zone rizières supérieures),Vakinankaratra,Betafo,Culture et histoire,Rizières supérieures Betafo,-19.8333,46.85,Zone haute rizières Betafo,Facile,2.5,0,0.0,Toute l'année,4.5,250,Lonely Planet,https://www.lonelyplanet.com/madagascar/attractions/betafo-upper-rice,Rizières en terrasses hautes classées UNESCO,Voiture ou taxi,Aucune,2
347,Lac Itasy (zone villages),Itasy,Arivonimamo,Culture et histoire,Villages autour du lac,-19.0667,46.7833,Villages lac Itasy,Facile,4.0,0,0.0,Avril à novembre,4.3,130,SafariBookings,https://www.safaribookings.com/blog/lac-itasy-villages,Villages traditionnels autour du lac volcanique,Voiture ou pirogue,Aucune,2
348,Chute de la Lily (zone inférieure),Itasy,Arivonimamo,Nature et parcs nationaux,Partie basse cascade,-19.0333,46.8,Zone basse Lily,Facile,1.5,5000,1.0,Avril à novembre,4.4,100,Audley Travel,https://www.audleytravel.com/madagascar/places-to-go/lily-falls,Partie inférieure de la cascade avec bassin,Voiture + courte marche,Sentier glissant,2
349,Massif Tsaratanana (zone base nord),Betsiboka,Bealanana,Aventure et randonnée,Base nord ascension,-16.7833,47.65,Zone nord Tsaratanana,Difficile,,40000,8.0,Avril à novembre,4.8,50,Lonely Planet,https://www.lonelyplanet.com/madagascar/attractions/tsaratanana-north,Zone départ nord pour ascension Maromokotro,Expédition guidée,Altitude élevée,4
350,Pic Saint-Louis (zone randonnée facile),Anosy,Taolagnaro,Aventure et randonnée,Sentier facile vers vue,-25.05,46.9833,Sentier facile Pic Saint-Louis,Facile,1.5,5000,1.0,Mai à novembre,4.5,150,TripAdvisor,https://www.tripadvisor.com/Attraction_Review-g298283-d614307-Reviews-Easy_Trail_Pic_Saint_Louis-Madagascar.html,Sentier accessible pour vue panoramique,Voiture + randonnée,Soleil intense,6
351,Plage Libanona (zone sud),Anosy,Taolagnaro,Plages et littoral,Zone sud plage Libanona,-25.0318,46.9993,Sud de Libanona,Facile,2.5,0,0.0,Mai à novembre,4.4,220,Audley Travel,https://www.audleytravel.com/madagascar/places-to-go/libanona-beach,Extension sud de la plage urbaine,Marche ou taxi local,Aucune,6
352,Rivière Onilahy (zone ponts),Atsimo-Andrefana,Betioky Sud,Géologie et paysages,Ponts naturels Onilahy,-21.6667,45.1667,Zone ponts Onilahy,Moyen,1.5,0,0.0,Avril à décembre,4.3,90,Lonely Planet,https://www.lonelyplanet.com/madagascar/attractions/onilahy-bridges,Ponts naturels formés par le fleuve,Voiture + pirogue,Courants,6
353,Oasis Amboasary Sud (zone artisanat),Anosy,Amboasary Sud,Artisanat et marchés,Artisanat oasis,-25.0333,46.3833,Zone artisanat oasis,Facile,2.0,8000,1.6,Mai à octobre,4.2,70,SafariBookings,https://www.safaribookings.com/blog/amboasary-crafts,Artisanat local dans l’oasis,Voiture depuis Taolagnaro,Chaleur,6
354,Mines Ilakaka (zone village minier),Ihorombe,Ilakaka,Culture et histoire,Village minier Ilakaka,-22.7667,45.2333,Village autour des mines,Facile,1.5,0,0.0,Toute l'année,4.1,120,Audley Travel,https://www.audleytravel.com/madagascar/places-to-go/ilakaka-village,Village minier animé par l’extraction de saphirs,Voiture + guide local,Sécurité minière,6
355,Forêt Mikea (zone chasse),Atsimo-Andrefana,Manja,Culture et histoire,Chasse traditionnelle Mikea,-22.5,43.5,Zone chasse Mikea,Moyen,8.0,25000,5.0,Avril à décembre,4.5,80,Lonely Planet,https://www.lonelyplanet.com/madagascar/attractions/mikea-hunting,Zone où observer pratiques de chasse traditionnelle,4x4 + guide,Accès difficile,1
